source,subreddit,date,title,text,score,url
reddit,femalefashionadvice,2015-06-17 06:28:09,Ultimate Weekender discussion: Everlane vs. Lo & Sons,"(Sorry if my title seems too stickied)

Hi guys, I'm finally taking the plunge in investing in a weekender bag. There's been talk that most airlines will reduce carry on sizes and I figured a weekender bag would still fit in their reduced sizing restriction (new measurements: 21.5 x 13.5 x 7.5). 

I'm drawn to [Everlane's weekender](https://www.everlane.com/collections/womens-bags) but I also like [Lo & Sons Catalina](https://www.loandsons.com/the-catalina) (that extra zipped up space below for shoes, dirty clothes, etc. is a great idea!) It also looks like Lo & Sons is having a sale right now too... haha. 

I've read some posts on this sub and asked about cleaning both bags as it's spot clean only, so I could go either way. Part of me wants to go with Everlane because it's cheaper but I'm really attracted to that extra space the Catalina has. 

A couple of questions:

* Is the Catalina really big? It looks ginormous and might barely fit in an overhead compartment?
* Difficult to carry (either one)/hard on your shoulder?

Thanks in advance for your help!

EDIT: I bought the Everlane weekender in Navy and I LOVE IT!!! Fits well on my shoulders and spacious. ",12,https://www.reddit.com/r/femalefashionadvice/comments/3a4vqy/ultimate_weekender_discussion_everlane_vs_lo_sons/
reddit,femalefashionadvice,2015-06-15 22:43:56,Inverted Triangles Unite!,"I'm an inverted triangle shape (shoulders 44"", bust 37"", waist 30"", hips ""34) and I'd like to hear about the styles and shopping habits of my fellow inverted triangles. My style is simple but feminine (which is very difficult to pull off in this age of decidedly masculine wardrobe minimalism) and for modern, ladylike dressing I wish I could wear an a-line dress with 3/4 sleeves OR a 3/4 sleeve sweater and an a-line skirt with ankle boots, kitten heels or flats. I refuse to look like a big little girl though (ZOE DESCHANEL) and drool over Whistles, Hobbs London and Jigsaw but for reasons of dallah dallah billz most of my wardrobe is from UNIQLO, J.Crew and Madewell. I think all three stores design with pear shapes in mind and even after discovering ffa (and spending a lot of time on into mind...) I often find shopping frustrating. I'd love to be able to shop at places that sell high quality basics in a steady range of neutral colors (e.g., Everlane, MUJI) but these clothes are better suited to people with narrower shoulders and smaller chests. For shoes, I usually look to the comfort shoes on Zappos (e.g. Born, Softspots, Sofft) and weed out the ones that don't look too granny. Inverted triangles, what is your style and where do you shop?!     ",35,https://www.reddit.com/r/femalefashionadvice/comments/39yye2/inverted_triangles_unite/
reddit,femalefashionadvice,2015-05-29 03:07:04,Everlane snap backpack size vs. Longchamp Le Pliage (or alternatives?),"So I just started a new job where I have to hike a fair bit to the bus, and I also have access to a gym at work that I can use to exercise, so I might bring exercise clothes with me along with all my food (ALL THE FOODS).  My small purse + lunch bag isn't enough, so I've been using my Longchamp bag but it isn't the most comfortable if I need to bring my laptop home.  I'm looking for a backpack that's a similar size to my Longchamp-I really like how stylish the Everlane backpack is but I'm not sure how much it will hold.  I'd love to hear some other suggestions as well!",2,https://www.reddit.com/r/femalefashionadvice/comments/37od3w/everlane_snap_backpack_size_vs_longchamp_le/
reddit,femalefashionadvice,2015-05-12 14:36:07,Am I doing something wrong or is this just not flattering on my body?,"Hi!  First off, if I'm doing something wrong or if I should be posting to the simple questions thread, please let me know.  I'm going to be headed to the dentist shortly, but I should be able to delete and repost before I have to leave (if need be).

Anyways!

So I've been seeing a lot of pictures of skirts [styled like this](http://4.bp.blogspot.com/-i47AySmaLIw/UzsnR2zUdpI/AAAAAAAAVSI/HvTHqD89r-o/s1600/full-navy-midi-skirt.jpg) lately and I really like the look.  I love skirts and dresses so I've been trying to emulate this look and it kind of looks awful.  Not only do I find this look flattering, but it would also allow me to wear my skirts lower on my body thus covering more of my legs which is a huge plus for me.  So I'm not really sure if I'm 1. doing something wrong, or 2. if my body just isn't flattered by the style.

My measurements are 33-27-36.5 and I'm 5'3"".  Below I've taken 4 pictures to show how I normally wear shirts vs. this type of styling.

1. [This picture shows me in a slightly fitted grey v-neck and a black skirt.](http://i.imgur.com/NILE3hm.jpg)  The shirt is tucked into the skirt and the skirt is pulled up to fit in the thinnest part of my body.  I think this is flattering because it highlights my waist.  For the record, I like bigger hips so I often like things that make mine look bigger.

2. [Here is a similar outfit.](http://i.imgur.com/34CUqsl.jpg)  I'm wearing another skirt with an Everlane Box Cut Tee in white.  I apologize for the wrinkles.  I had to take this shirt out of the laundry but I wanted to show the style with two completely different cuts. 

3. [Here, we have the same black skirt and grey shirt, but with the shirt un-tucked.](http://i.imgur.com/z9h6dDM.jpg) To me this looks awful, sloppy, and frumpy.

4. [Finally, we have the polka dot skirt and box cut tee, un-tucked.](http://i.imgur.com/78KRv83.jpg)  I think this looks SLIGHTLY better but the boxy cut eats away at my waist.  Also, I know the wrinkles look awful and lazy.  Again, I apologize for that.

So, I'm thinking that maybe this look would be more flattering with a cropped but tighter fitting shirt?  Or, is it simply that my body type is best flattered by having the band of the skirt to highlight my small waist?

With all of that said, does anyone have opinions on how a skirt [this length](https://s-media-cache-ak0.pinimg.com/736x/c3/05/b3/c305b306bf13ca2e89f5bac100f19efe.jpg) would look on my short frame?

**tl;dr I like tops worn over - as apposed to tucked-into - skirts, but I think that style is unflattering on my body type.**",144,https://www.reddit.com/r/femalefashionadvice/comments/35pqzm/am_i_doing_something_wrong_or_is_this_just_not/
reddit,femalefashionadvice,2015-05-10 06:12:23,Best weekender bags?,"Hi Ya'll, 

I'm in the market for a great weekender/large bag for shortish trips. I was at nordies the other day and fell in love with the Longchamp
'Le Pliage' Expandable Travel Bag (21 Inch), but before taking the $255 leap, wanted to see if you all have any advice. I don't know what other cute bags are out there that have the many desirable qualities of the Longchamp travel bag: 
- It's expandable to a huge size, yet folds down to nearly nothing
- Still cute when expanded
- Handles for carrying but also a shoulder strap
- Machine washable
- Super Durable 
- Water resistant

I also really like the everlane travel bags, but they aren't expandable, nor can you throw them in a washing machine... 

Would love to see what you think!

Thanks :) 

",12,https://www.reddit.com/r/femalefashionadvice/comments/35gwwv/best_weekender_bags/
reddit,femalefashionadvice,2015-05-06 17:27:03,"Worried my style is too diffuse, that I look ridiculous, and that I'm losing sense of what I like in order to please others.","Hello, friends- it's spongefan89, but for some reason I've been unable to post anything for the past month or so due to ONE post of mine being downvoted into oblivion on /r/AskWomen.

**TLDR at bottom**

I've spent a lot of time on this sub in the past month and gotten great advice, almost always said in a tactful and kind way.  Most of you probably know my OOTDs since I post so often, but...here's all of them: http://dressed.so/user/view/spongefan89

Basically, earlier this year I had several goals for fashion: Look non-dated, on-trend, young (people tend to think I'm older and I've heard it's because I ""dress mature"", so I tried to reduce the stuffiness with more fun items), and I want to accentuate/flatter my figure.  As far as style icons go, Kim/Kendall Kardashian (yes, I know) are some fashionable people I admire.  Their clothes aren't boring, but they also aren't flashy and ridiculous, to the point where they look silly. 

So basically, I don't want to be flashy and ridiculous, but I don't want to blend in either.  I want to be the kind of person who walks into a room and people turn and say ""Wow, where did she get *that* dress?""  I guess is the best way of describing it.  I see a lot of women who look nice and put-together but nothing really ""wows"" me, and that's not what I'm going for.  

I like some very athletic/casual stuff, but I also really love bodycon dresses and heels.  Sometimes I worry this is too diffuse, but I feel like work for different situations and setings, and could make sense in the same wardrobe/style profile.

I also sometimes feel a little worried on this sub because I feel like there are some things that most people here love (for example, Everlane, J Crew, all-black, neutrals, floor-length cardigans, boyfriend jeans etc) that I don't really like.  I also know a lot of people aim to look older and be ""taken more seriously"", hide their bodies that other people find too attractive, where I actually have the reverse problem (I'm jealous that I'm not attractive enough to have these problems!)  

So sometimes I wonder if the advice I get here is based on other people just having different goals from me, and sometimes I feel this urge to rid of all my trendy items and just dress in all black, have 50 things in my closet that all cost $200...but then I think...would that even be *me* at all?  How do I balance wanting to be me, but also not wanting to look ridiculous?

**TLDR** I don't think my style fits in well with what's popular here and I am trying to stay true to what I enjoy while also taking advice and not looking ridiculous.

Final question:
**Has anyone else struggled with defining their style, especially when it isn't what tends to be popular in your group/on this sub/among your friends?  Any more specific advice for me as I go through this journey?  Thank you!**

",11,https://www.reddit.com/r/femalefashionadvice/comments/352w27/worried_my_style_is_too_diffuse_that_i_look/
reddit,femalefashionadvice,2015-04-25 02:38:39,Are big leather totes with zippers the unicorns of the leather goods world?,"I'm in love with the Everlane Petra Market in navy. https://www.everlane.com/collections/petra/products/petra-market-bright-navy I'm going to grad school next year, so I'd planned on justifying the price as just another ridiculous expense that I'd endure. But. Where's the zipper? I know I'm not the first one to lament the lack of zipper or closure on Everlane bags. But I use public transit. I live in California, so rain's sure not an issue this year,  but hopefully it will be in the future. I need a large classic leather bag, similar in every way to the Petra Market, but one with a dang zipper. Tell me, dear FFA readers, is this too much to ask?",29,https://www.reddit.com/r/femalefashionadvice/comments/33s5zj/are_big_leather_totes_with_zippers_the_unicorns/
reddit,femalefashionadvice,2015-04-24 18:23:34,Searching for a new college bag - Herschell woes and Everlane curiosity - advice please!,"I'll preface by saying that yes, there are other posts in this subreddit that touch on this topic, but they're very dated and I'm interested in some updated info! I've been looking  for a bag (backpack or tote) that can carry daily essentials (notebook, planner, wallet, pencils, water, etc.) and that also has the capability to carry a 13"" laptop (I don't have one currently but may be getting one in the near future.) My major doesn't require me to carry heavy textbooks regularly, and when I do have one I carry it in my hands, so that's not a concern of mine. I prefer simplistic, classic pieces with a casual yet put-together vibe. I want something that is fashionable and will pair well with a laid back outfit and if I'm wearing something dressy/casual too. I've narrowed this down to two routes/options and I'd like feedback on these brands/models! This is somewhat time-sensitive due to return policies! 





My SO recently bought the Herschel Settlement Backpack for me in the spring color palette ivory/mango/foliage, but I'm considering returning it. I was really excited for it because I have been using my largest purse for school for over a year and I really need something specifically for school. I also loved the light color pop, as most of my clothing is nuetral. First, the bag seems extremely stiff, and because I wouldn't be carrying heavy items I'm worried it wouldnt relax. The straps are also slightly uncomfortable because my shoulders are narrow and they hit my inner-arms. Also, I was disappointed to find out that the exact color scheme was one of 2 that UO picked up for spring, so I can be sure to see a lot of people with the specific pack on campus soon (petty but I'm sure you can understand haha!) More importantly though I'm skeptical about the quality and I'm disappointed in the lack of any organization in this bag. The website states that it comes with media pockets, but there is only one in an obscure location that I'd be lucky to fit a 1st generation iPod nano in nonetheless my iPhone 6. I was looking for validation or wondering if the bag would relax but I cannot find reviews on Herschel ANYWHERE online, which is a bit baffling...


Anyway, I've also been looking at Everlane products. I really like the simplicity/versatility of the tote; I'm curious about the internal organization though. I like the snap-backpack too, but I'm worried about size - I'm 5'1"" so backpacks tend to overpower me easily. I've heard great things though, and I'm eager to try the brand. 


Any insight, reviews of these bags, or suggestions about other bags would be great! Ultimately I'm trying to stay under $70. 


Edit: time sensitivity ",5,https://www.reddit.com/r/femalefashionadvice/comments/33qlu9/searching_for_a_new_college_bag_herschell_woes/
reddit,femalefashionadvice,2015-04-22 15:56:21,"US sizes! First time in the US, help a European shop!","So, I am from Germany/the Netherlands and will spend my birthday week (next week) in NYC!

I am travelling with my boyfriend and we have a huge list of things we want to do and see, but besides that I also want to SHOP! 

Since we won't have much time, I am now already looking online for things I might want to buy and shops I want to visit, and in the process I've realized that I have absolutely no idea what size I am in the US.

Of course I will try things on if possible, but I don't want to have to lug 4 different sizes of every item into the changing rooms. Also, to avoid wasting time and overstretching my boyfriend's patience I would also prefer to be able to buy some things (like workout clothes, shorts for lounging, tshirts, underwear except for bras, and basic tops) without having to try them on first. Our hotel is right in the center of manhatten, so I could always return things if they really don't fit.

US sizes confuse me so much because they seem to have a much wider range than European sizes. Here in Germany I am a 36, which is always the second smallest size. On size conversion charts it says a German 36 corresponds to a US 6, but a size 6 is like the fifth smallest size! Plus, from US media/blogs/TV I got the impression that a size 6 is kind of an average size, not too slim, and models wear a size 2 or 0 right? In Germany a model would be a 34 or 36 like me (although they are much taller obviously). 

The same with letter sizes (not sure if that's the right term): In Germany I am always either a size S, or an XS if I want it tighter, which is always the smallest size, but in the US sizes go down to XXS.

I am 5 foot 5, 123lbs, measurements are 35-25-36 (bra size is 32C). All my jeans are a size 26, and in general I am relatively easy to fit and can usually buy most things without trying them on. But I have a feeling that compared to the US, sizes may be more uniform here. I often read about people in the US complaining about vanity sizing and being a size 8 in one store and a size 2 in another. I am just always a size 36, sometimes 34 but that's it. 

Can you guys help me out? What sizes should I try on first? From what I have read I am thinking maybe a 2 or a 4? Or is that completely off? 

Stores I definitely want to go to: Everlane (the NYC delivery thing), Madewell, Lululemon, American Eagle and Aerie, Free People, maybe J.Crew. Everlane is particularly tricky, because they have letter sizing, and I probably couldn't easily exchange items because of the delivery thing. ",12,https://www.reddit.com/r/femalefashionadvice/comments/33hj3a/us_sizes_first_time_in_the_us_help_a_european_shop/
