source,subreddit,date,title,text,score,url
reddit,Everlane,2022-01-17 03:46:21,Built a tool that makes sure clothing you order fits perfectly!,"Hi there! Briefly, I built a Chrome extension called ""Ember"" that automatically selects your sizes while shopping online, so orders fit perfectly, every time. It's free and available in the [Chrome store](https://chrome.google.com/webstore/detail/ember-12/ddieocknklgdnmdleflioopohbcljbej). The first website I built it to work on is [everlane.com](https://everlane.com), hence the post here :) Feel free to check it out and share with friends. And I'm happy to answer any questions. Cheers!",22,https://www.reddit.com/r/everlane/comments/s5u3d9/built_a_tool_that_makes_sure_clothing_you_order/
reddit,Everlane,2022-01-14 19:06:02,Everlane Jean Sizing Discrepancy,"I just placed my order in my usual denim size with Everlane. Then I went back and check the Size Guide and OMG! Why the huge discrepancy now???

I always thought Everlane is one of the few left that is true to sizing measurements. But they went the popular way now of making ladies feel their waist is 25"" when the actual jean size is 27""! How is that the same???",4,https://www.reddit.com/r/everlane/comments/s3zy16/everlane_jean_sizing_discrepancy/
reddit,Everlane,2022-01-10 17:44:56,is anyone interested in a pair of everlane day heels?,"I'm selling on poshmark. I accidentally got them a size too big for me. They are a size 5.5 in very good condition. They've only been worn around the house before I realized they were a little too roomy for me. If anyone is interested, please PM me! 

Also I apologize of this kind of post isn't allowed here",7,https://www.reddit.com/r/everlane/comments/s0ps4b/is_anyone_interested_in_a_pair_of_everlane_day/
reddit,Everlane,2021-12-16 22:05:39,Double order,"Has anyone ever been sent their order twice? I got a confirmation email for my Black Friday order and then a couple days later got another confirmation email for the same items — I thought nothing of it. Until I got delivered the same order twice. As far as I can tell, I only got charged once. Did this happen to anyone else recently? Idk what to do now haha",2,https://www.reddit.com/r/everlane/comments/ri1ht9/double_order/
reddit,Everlane,2021-12-06 21:50:55,Cigarette jeans,"Do you all remember the cigarette Jean? It was a slim Jean in authentic stretch with a button fly. I don’t think everlane has any slim fit jeans like this, and definitely not with the stretch material. Any ideas for dupes, whether inside or outside of everlane? I also considered trying to find a fit with the slim mens jeans they have now at everlane. Thanks for any suggestions!",3,https://www.reddit.com/r/everlane/comments/rair0i/cigarette_jeans/
reddit,Everlane,2021-11-29 23:08:26,Duvet Puffer too long?,"Anyone have the Duvet Puffer? Just ordered mainly because it was on sale, actually was going to get the highly reviewed renew long puffer but sales always get me.. now I’m thinking is it too long? I haven’t ever had a coat that was so long, so I’m unsure if I’ll like it now that I’m overthinking it ha. I ordered a medium and I’m 5’8” (I’m a size 6)[everlane duvet puffer coat](https://www.everlane.com/products/womens-redown-duvet-coat-black?locale=US&utm_medium=cpc&utm_source=pla-google&utm_campaign=842259054&utm_content=431545389544&utm_term=pla-293946777986&adgroup=98427411537&pid=10171-76530&device=m&gclid=Cj0KCQiAkZKNBhDiARIsAPsk0WiePXrjAeBNGHE0foOksKySN1-3xNh5_VNeEDtqUsgtjqzCekw_LDQaAiTcEALw_wcB)",1,https://www.reddit.com/r/everlane/comments/r58b25/duvet_puffer_too_long/
reddit,Everlane,2021-11-26 21:35:45,Why do Everlane orders take so long to ship?,"I live in Australia and have ordered from Everlane a few times. The quality of the clothes is really hit and miss, but they have some basics that I like. I placed an order for 3 items on 22 October and still haven’t got it. I enquired about it after 10 days or so of no tracking updates, apparently the order was lost, the re-sent it via express shipping, that was two weeks ago and it still hasn’t left the US. Their orders do always take much longer than other brands, this time even more so, and it’s so annoying and seems odd when other overseas brands ship to Australia in a week or so. Does anyone else feel like Everlane orders take forever to arrive?",16,https://www.reddit.com/r/everlane/comments/r2xe9l/why_do_everlane_orders_take_so_long_to_ship/
reddit,Everlane,2021-11-03 20:26:37,ReNew Long Puffer - Chestnut,"I have been trying SO HARD to find a small/XS ReNew Long Puffer in Chestnut for my wife. 

We are going to NYC in December and i am trying to find one.

Does anyone have one for sale or knows where? I have called every store, no one has it in time.",1,https://www.reddit.com/r/everlane/comments/qm3eo1/renew_long_puffer_chestnut/
reddit,Everlane,2021-10-09 16:40:43,Where is the Day heel?,Did they really discontinue it or are they revamping? Lmk!,6,https://www.reddit.com/r/everlane/comments/q4owv2/where_is_the_day_heel/
reddit,Everlane,2021-08-27 00:25:27,Looking for feedback on fit of French Terry Crew and Crewneck Shirts,"I'm currently in a remote rural area, and haven't bought clothes for years. Most of my items are falling apart after excessive wears, and I'm interested in ordering the French Terry Crewneck Sweatshirt and a few cotton t-shirts. So all this would be done online. There are no Everlane stores within even a few states.

I'm 6' 1"", slim build, normal shoulders, about 165 lbs. Sometimes I'm a large due to my length, sometimes I'm a medium due to my build. I've often bought medium items from others that fit perfectly only to have them shrink even from a cold wash. In other brands I'm a large. Since I'm ordering by mail does anyone have experience ordering in these sizes? Would a large be better to have a little room and have it shrink down? Or is medium better for my build?

Technically I could order both sizes but the price would be doubled and then I'd wait up to a month for a refund (according to the Everlane site). Any hot tips are most appreciated.",1,https://www.reddit.com/r/everlane/comments/pcc6mj/looking_for_feedback_on_fit_of_french_terry_crew/
reddit,Everlane,2021-08-02 17:05:59,No zippers,"Hi everyone,

Is anyone else frustrated by the lack of zippers in the main enclosure of Everlanes bags ?  I find that I have to worry about things falling out of my bag with the magnetic enclosure, especially in the car",2,https://www.reddit.com/r/everlane/comments/owiweg/no_zippers/
reddit,Everlane,2021-07-30 14:37:07,Are the day heels worth it? Do they live up to the hype?,,8,https://i.redd.it/9l3k706x2de71.jpg
reddit,Everlane,2021-07-17 08:44:59,Giving life to the old school everlane backpack!,,7,https://www.reddit.com/gallery/om0kmg
reddit,Everlane,2021-07-07 15:56:46,Everlane duffle bag,"Does anyone know where I would be able to find a black everlane duffle bag. I tried to buying onebut was having issues with my card, when I fixed the issue the bag was sold out with no plans on restocking. Any info would be appreciated.",1,https://www.reddit.com/r/everlane/comments/oflrxc/everlane_duffle_bag/
reddit,Everlane,2021-06-30 13:11:37,Did everlane have sales?,Anyone know if they'll do a fourth of July sale?,3,https://www.reddit.com/r/everlane/comments/oax1ik/did_everlane_have_sales/
reddit,Everlane,2021-06-20 12:39:34,Does anyone know how often the sales are updated?,"I check periodically, but it’s always the same stuff.",2,https://www.reddit.com/r/everlane/comments/o44uga/does_anyone_know_how_often_the_sales_are_updated/
reddit,Everlane,2021-05-23 16:45:26,How do Everlane jeans compare to Madewell?,"I’ve been a big fan of Madewell’s high rise curvy skinny, but just want something a bit more rigid (but still with a little stretch). Has anyone done a comparison between the two brands? I’m a size 26 in Madewell, and am curious as to how the sizes compare, too.",13,https://www.reddit.com/r/everlane/comments/njblmo/how_do_everlane_jeans_compare_to_madewell/
reddit,Everlane,2021-03-31 23:31:11,Is this “P” on a pair of Everlane pants for petite?,,3,https://i.redd.it/hm7cze2w7gq61.jpg
reddit,Everlane,2021-02-25 14:48:03,When did Everlane start putting branding on their clothes?,"I purchased everlane french terry hoodie in navy a bit ago and i love it.  When it is cooler out, it is my go to hoodie and at the time, what I loved about it so much was that it was cozy, minimal and had no branding.  I decided to get another french terry hoodie recently in a different color and noticed a big E stitched on the arm by the cuff.  It's not that noticeable but I know its there and it kind of puts me off to purchasing anything else.  Does anyone know about this change?",5,https://www.reddit.com/r/everlane/comments/ls851o/when_did_everlane_start_putting_branding_on_their/
reddit,Everlane,2021-02-19 16:44:24,Return without tags attached?,"I just got some jeans today not realizing how extremely short they were. I wore them for maybe 5 minutes before deciding they really were too short for me. I know their return policy says return with tags attached, but has anyone tried to return something without tags attached (but still with the tags) and gotten a refund?",1,https://www.reddit.com/r/everlane/comments/lnkcbz/return_without_tags_attached/
reddit,Everlane,2021-02-11 19:42:39,Everlane does not make quality products,"I purchased several items from Everlane a little over a year ago, in October of 2019. It was my first foray into clothes of this price but wanted to be more environmentally friendly when it came to my wardrobe. The items I purchased were multiple pairs of jeans, a few oxford shirts, underwear, merino wool and cashmere sweaters. I spent over $1500 on items in total. In a little over a year, most of my items are fraying and one pair of $72 jeans has a giant hole in the inside of the pant leg. When I reached out to Everlane about the jeans, they only offer to give me a $15 credit to pay for a tailor to fix the hole. If you are looking for quality, this is not the company for you. All of their products are made overseas, in China and Vietnam and the quality sure shows. If you want to help the environment, find pieces of clothing that LAST. Everlane is not the company for those needs. I have pictures of my clothes and the fraying and holes if anyone wants to see them.",9,https://www.reddit.com/r/everlane/comments/lhssb6/everlane_does_not_make_quality_products/
reddit,Everlane,2021-02-05 17:47:18,can anyone link the sweater that this model is wearing?,"https://www.everlane.com/products/womens-italian-goweave-easy-pant-black?collection=womens-sale

it’s the blue sweater the model is wearing",1,https://www.reddit.com/r/everlane/comments/ldcpie/can_anyone_link_the_sweater_that_this_model_is/
reddit,Everlane,2020-12-14 17:58:27,Everlane vs Uniqlo cashmere crew neck,"I’m in between the two brands, and I would be saving a ton of money buying from Uniqlo, but I want quality!  Have any of you bought the cashmere crew neck from each brand and what difference is there?  Or is there any difference?

Thank you!",3,https://www.reddit.com/r/everlane/comments/kd2mwg/everlane_vs_uniqlo_cashmere_crew_neck/
reddit,Everlane,2020-12-11 05:48:34,Thoughts on the Forever Sneakers?,Been thinking of getting a pair since they are pretty affordable but I wanted to see if the quality was good and if it's comfortable to wear?,2,https://www.reddit.com/r/everlane/comments/kawwbc/thoughts_on_the_forever_sneakers/
reddit,Everlane,2020-12-08 03:49:52,Anyone know what carrier they use for prepaid return labels?,"I need to start a return and whether I choose ""Mail in items"" or visit a ""Return Bar"" depends on which carrier the mail in return label is with - UPS vs USPS vs Fedex. If anyone happens to know this, that would be very helpful! Looked all over the website and couldn't find it. Reached out to customer service but might take a few days to hear back.",3,https://www.reddit.com/r/everlane/comments/k8wsrx/anyone_know_what_carrier_they_use_for_prepaid/
reddit,Everlane,2020-12-03 02:26:25,Wondering if anyone from canada has ordered from everlane! How much did you get charged duties ?,,6,https://www.reddit.com/r/everlane/comments/k5ocor/wondering_if_anyone_from_canada_has_ordered_from/
reddit,Everlane,2020-11-18 20:24:08,Nonsensical pants sizing??!,"So everlane’s non-denim bottoms use standard 2/4/6/etc sizing and it’s pretty easy to figure out what your size is using the size guide. Their jeans on the other hand use sizes ranging from 23 to 33. Most of the numbers in this range are typical waist measurements, though I’ll admit a 23 inch waist is insanely tiny and having the highest waist size be 33 would exclude a lot of people. HOWEVER, contrary to what you’d expect, these size numbers do NOT correspond to the item’s waist measurement!! Like I usually wear a 29 in waist in pants and according to the size guide that would make my size with them 26??? But then I ordered that and the jeans were waaay too small. So I was like “ok maybe I misunderstood the guide” and went ahead and reordered them in a 29, and those were way too big. So I’m about to reorder for a third time and it seems like it’s gonna be a crapshoot as to whether or not they fit since the guide is absolutely zero help. I just had to put this rant somewhere, because why in the actual fuck would they use numbers associated with standard waist measurements for their sizing numbering, and then have the sizes not correspond to the waist measurement whatsoever?! Feels very misleading. Smfh",5,https://www.reddit.com/r/everlane/comments/jwnlsp/nonsensical_pants_sizing/
reddit,Everlane,2020-11-05 16:00:26,The Modern Utility Chelsea Boot Sizing,"If anyone has bought these shoes ...  I typically am a size 7.5/8 and I got an 8. It fits perfectly for my foot, but it's a bit tight at the ankle. Would you recommend going up a size? or does the shoe stretch out around the ankle??? would appreciate any recommendations :) also i love the look of the shoes!!!",5,https://www.reddit.com/r/everlane/comments/jol9mz/the_modern_utility_chelsea_boot_sizing/
reddit,Everlane,2020-09-13 23:51:54,I am working on tech+fashion tools to enhance the buy/sell/trade experience in online communities and would love your thoughts. <3,"Hi fellow Everlane lovers! I am working on tech+fashion tools to enhance the buy/sell/trade experience in online groups for members and moderators.

Do you use this group or others on Reddit, Facebook, or Instagram to buy, sell, or trade Everlane or other brands? To make it the work best for you I would love to understand what you currently like or dislike. I will be providing one $20 Amazon gift card at random to one of the people who fill out the survey. :)

The survey takes 3-4 minutes. I really appreciate it: https://carleylake22.typeform.com/to/mFb1YlEW",1,https://www.reddit.com/r/everlane/comments/is9o28/i_am_working_on_techfashion_tools_to_enhance_the/
reddit,Everlane,2019-08-09 17:10:04,Everlane in Canada?!,"Has anyone from Canada had any issues ordering from Everlane? Or are there locations in Canada selling them now? 
Thank you in advance! :)",2,https://www.reddit.com/r/everlane/comments/co5bvu/everlane_in_canada/
reddit,Everlane,2019-05-12 18:00:43,Everlane Introduces the Birth Control Pant,,2,https://medium.com/badfash/everlane-introduces-the-birth-control-pant-cb26af156e16?source=friends_link&sk=a695dce032546993a557c0b912f1f061
reddit,Everlane,2019-02-23 23:14:20,Day glove shoes in white and high waisted ankle jeans,,5,https://i.redd.it/k4f5txfqhei21.jpg
reddit,Everlane,2018-11-06 22:48:48,Everlane did not respond when fraudulent purchases were made,"Someone hacked into my Everlane account, added a shipping address, and made a purchase using my saved credit card.  I notified Everlane immediately and was told I would be contacted by a team member.  I just received the notice that the fraudulent orders had been shipped.  Very disappointing, very poor business model, great way to lose customers.",2,https://www.reddit.com/r/everlane/comments/9utcr2/everlane_did_not_respond_when_fraudulent/
reddit,Everlane,2017-04-29 20:18:01,Everlane Backpack advice/questions?,"Hi guys, I've been looking at Everlane's backpacks, specifically the Modern Zip (large) and the Snap backpacks. I have a 15.6 in laptop so I was wondering if it would fit in the Zip one, since I heard it fits in the Snap ones. I personally tend to like using zippers more because it's more practical for me, but if anyone could give me advice it would be great. I'm also a 5'3"" girl so if the size would be too big for my height please lmk. Thanks in advance! ",1,https://www.reddit.com/r/everlane/comments/68bgmp/everlane_backpack_advicequestions/
reddit,Everlane,2016-06-07 22:02:41,"Is Everlane just a marketing scam? I bought a few pieces for the first time, dont know why the fashion bloggers are recommending the brand. The silk is very thin. The cashmere is not soft and make skin itch. The price isnt that low, definitly cant justify the quality. Uniqlo is a better choice.",,2,https://www.reddit.com/r/everlane/comments/4n1mk1/is_everlane_just_a_marketing_scam_i_bought_a_few/
reddit,everlaneclothing,2026-03-25 14:44:39,Everlane poor quality snd service,"Just found this sub and want to say stay away. I'm male and looking for one T-shirt brand I could trust and keep buying. It's not Everlane.

A few years ago, Everlane was recommended everywhere online as American-made and ultimate quality. I ordered two of the standard tees to start, expecting to order a bunch more if they fit well. First thing I noticed, they were made in Vietnam not in USA. Rechecked several recent articles and videos all claiming American made meant they were worth it. Just marketing bs as only the cotton is grown in the US.

They looked good on arrival, but felt very thin. Rechecked again and they claimed the trend was lighter, softer fabric. After one wash, the truth was they were cheap and poorly made.

One collar was stretched out asymmetrically like an irregular or defect. The other torso twisted severely at the bottom, the side seam ending all the way in front. They were terrible and falsely hyped.

I contacted Everlane through the website. I simply stated the defects above and asked to return them for a refund. At the time, their policy said return to the store, but there wasn't one near me. Before even considering a return, they wanted proof. They sent instructions how they wanted the shirts photographed. I am not going to model them in a mirror while taking selfies like a fool! The defensive policy asking for proof was all I needed to know Everlane is just a shady fashion brand built solely on marketing.",0,https://www.reddit.com/r/everlaneclothing/comments/1s3crge/everlane_poor_quality_snd_service/
reddit,everlaneclothing,2026-03-23 20:23:21,Everlane is not for midsize girlies,,2,https://www.reddit.com/gallery/1s1se2w
reddit,everlaneclothing,2025-09-15 16:33:51,Welcome to everlaneclothing!,"I've been an Everlane customer for the last few years and wanted to create a space to discuss their clothing and business moves, as they've recently seemed to go through a re-vamp. Looking to create a space for all who want to discuss Everlane, including those who love it all AND those with critiques or mixed thoughts. If you are interested in modding, let me know.....",4,https://www.reddit.com/r/everlaneclothing/comments/1nhqr6n/welcome_to_everlaneclothing/
reddit,ethicalfashion,2026-05-18 13:16:24,Shein reportedly buying apparel brand Everlane,"Yikes. I‘ve been bummed about Everlane going so downhill, seems they have finally sold out ",314,"https://us.fashionnetwork.com/news/Shein-reportedly-buying-apparel-brand-everlane,1832703.html"
reddit,ethicalfashion,2025-11-10 21:49:00,Everlane Making Me Opt Out of Shipping Insurance?,"Hi, all,

I bought some things at Everlane online today, and afterward I received an email from a company called Onward. Onward informed me that I had been ""upgraded"" and would be charged for insurance on my purchases. Onward said I could ""downgrade"" and avoid the charges, but Everlane couldn't guarantee the shipment would arrive (or something). 

I checked my Everlane receipt, and sure enough, there was an extra charge of $15 for ""Onward,"" which I hadn't noticed. I never checked a box saying i wanted whatever service ""Onward"" was providing. Everlane just tacked it on.

I think it is super unethical to slip a charge onto a customer's transaction like that. Had I not opened the email from Onward (I initially thought it was phishing), I would have missed it. Also, the services of Onward seem quite unnecessary. If the package arrives damaged or doesn't arrive, Everlane will have to make it right (which, I assume, they have done in the past).

I requested a refund by clicking the ""downgrade"" link in the Onward email. And now I guess I have to watch my credit card statement to see if it ever arrives?

Has anyone else experienced this problematic practice at Everlane or elsewhere?

P.S. I complained to Everlane, and they replied to explain the benefits of Onward. So they don't plan to change this practice, apparently.",24,https://www.reddit.com/r/ethicalfashion/comments/1otr4g4/everlane_making_me_opt_out_of_shipping_insurance/
reddit,ethicalfashion,2025-07-23 17:32:12,Did something change at everlane?,Before I got pregnant everlane used to be one of my go tos but then I heard they greenwashed and saw they had either “it’s a start” or “not good enough” on good on you (can’t remember which). Gotta buy new pants now and I noticed everlane is now “good”. Soooo what changed? Anybody know if it’s legit?,37,https://www.reddit.com/r/ethicalfashion/comments/1m7flco/did_something_change_at_everlane/
reddit,ethicalfashion,2025-02-21 20:46:11,Everlane Jeans,"Do Everlane jeans stretch out with wears or to the contrary, shrink in the wash?

I just received my Everlane jeans and I love them. However, I'm not sure if I should size up or not. Currently they feel snug and supportive on the belly and a little tight on the bum (riding up/wedging). This specific model is 2% elastane.

I don't plan to wash them frequently as they are a dark wash.

Thanks!",0,https://www.reddit.com/r/ethicalfashion/comments/1iv180x/everlane_jeans/
reddit,ethicalfashion,2025-01-26 21:39:56,ISO: the perfect dark blue denim jacket with a boxy fit,"I am a girl that likes a men's kind of fit for a denim jacket that I can wear over a hoodie in a dark blue color. The issue with getting a more hourglass shape jacket is that I'm concerned that if I get it large enough to fit over a hoodie, it will look funny. Plus I like a more androgynous/masc leaning aesthetic right now. 

Brands I've considered: 
Able (except the one boxy cut they have doesn't come in a dark blue)
Everlane 
Quince 

Thoughts?

Edit: also considering the brand ""outerknown""
Edit: and I'm totally willing to look for used things on eBay/Poshmark etc",3,https://www.reddit.com/r/ethicalfashion/comments/1iarale/iso_the_perfect_dark_blue_denim_jacket_with_a/
reddit,ethicalfashion,2024-04-17 19:40:17,Brands in between 'boring' and 'LOUD' style wise??,"Ethical fashion subs everywhere are no stranger to posts complaining about how *boring* so much of the non-fast-fashion world is, and I do totally get it. But then all the recommendations that come in are always for brands that are making stuff that is suuuuper ""loud"" style wise—like bold colors and patterns and modern vibes and CHEETAHS AND LIGHTNING STRIKES!

The thing is I'm tired of seeing the same old boring sweaters and tees too, but bold modern primary color-filled look also isn't my personal taste. I'm wondering if anyone has any fave brands that strike a nice balance between the two? I'm totally down for interesting cuts/patterns, nice details, a bit of creativity, etc. but not so maximalist.

I feel like there's gotta be a happy medium between the cookie cutter **Everlanes**, and the BIG BRIGHT PATTERN AND *SHAPES* **NOOWORKS** of the world.

I don't buy new things often but when I do find myself in need of a new piece I feel like I don't really have any go-to brands to check out (or look for things secondhand from) that actually suit my style. If anyone has any suggestions I'd love to hear them! :)",69,https://www.reddit.com/r/ethicalfashion/comments/1c6j2ca/brands_in_between_boring_and_loud_style_wise/
